{
  "_id": "6871c6d42e3d4c6c9c9a1001",
  "check_id": "7df76e95-9e5b-4aef-b09e-f7ab826afdf6",
  "status": "COMPLETED",
  "risk_level": "MEDIUM",
  "rules_decision": "MANUAL_REVIEW",
  "automatic_decision": "MANUAL_REVIEW",
  "final_decision": "APPROVED",
  "created_at": "2026-07-01T15:30:01Z",
  "completed_at": "2026-07-01T16:05:17Z",
  "transaction": {
    "transaction_id": "5a5cb1d2-38e5-4d39-b6a0-215dfe4e7138",
    "sender_account": "NL91ABNA0417164300",
    "recipient_account": "NL20INGB0001234567",
    "amount": 1500.50,
    "currency": "EUR",
    "transaction_date": "2026-07-01T15:30:00Z",
    "ip_address": "192.168.10.15",
    "origin_country": "NL",
    "device_id": "device-f3c91d88",
    "payment_channel": "MOBILE_APP",
    "tariff": "Premium"
  },
  "manual_review": {
    "review_id": "f44bdb95-5b34-4328-8d63-b37b44d5eaf4",
    "mr_status": "COMPLETED",
    "comment": null,
    "final_decision": "APPROVED",
    "created_at": "2026-07-01T15:30:08Z",
    "completed_at": "2026-07-01T16:05:17Z"
  },
  "fraud_rules": [
    {
      "_id": "5961c6d53e3d7c6c1c9a2002",
      "rule_id": "2b9fa56f-1980-4cf9-9dcb-91b89cbff6cb",
      "rule_name": "Крупная сумма",
      "rule_description": "Запускает дополнительную проверку при переводах на сумму свыше 100000 EUR",
      "is_active": true,
      "created_at": "2026-07-01T15:30:02Z",
      "updated_at": "2026-07-10T15:30:02Z"
    }
  ]
}